<?xml version="1.0"?>
<xs:schema xmlns:xs="http://www.w3.org/2001/XMLSchema"
           targetNamespace="http://www.w3schools.com"
           xmlns="http://www.w3schools.com"
           elementFormDefault="qualified">

    <xs:element name="gadgets">
        <xs:complexType>
            <xs:sequence>

                <xs:element name="Maskinvare">
                    <xs:complexType>
                        <xs:sequence maxOccurs="unbounded">
                            <xs:element name="category" type="xs:element">
                                <xs:complexType>
                                    <xs:sequence maxOccurs="unbounded">
                                        <xs:element name="gadget" type="xs:element">
                                            <xs:complexType>
                                                <xs:sequence>
                                                    <xs:element name="title" type="xs:string" />
                                                    <xs:element name="description" type="xs:string" />
                                                    <xs:element name="price" type="xs:decimal" />
                                                    <xs:element name="image" type="xs:string" />
                                                </xs:sequence>
                                            </xs:complexType>
                                        </xs:element>
                                    </xs:sequence>
                                    <xs:attribute name="category" type="xs:string" />
                                </xs:complexType>
                            </xs:element>
                        </xs:sequence>
                    </xs:complexType>
                </xs:element>

                <xs:element name="Programvare" type="xs:element">
                    <xs:complexType>
                        <xs:sequence maxOccurs="unbounded">
                            <xs:element name="category" type="xs:element">
                                <xs:complexType>
                                    <xs:sequence maxOccurs="unbounded">
                                        <xs:element name="gadget" type="xs:element">
                                            <xs:complexType>
                                                <xs:sequence>
                                                    <xs:element name="title" type="xs:string" />
                                                    <xs:element name="description" type="xs:string" />
                                                    <xs:element name="price" type="xs:decimal" />
                                                </xs:sequence>
                                            </xs:complexType>
                                        </xs:element>
                                    </xs:sequence>
                                    <xs:attribute name="category" type="xs:string" />
                                </xs:complexType>
                            </xs:element>
                        </xs:sequence>
                    </xs:complexType>
                </xs:element>

            </xs:sequence>
        </xs:complexType>
    </xs:element>

    <xs:element name="price">
        <xs:simpleType>
            <xs:restriction base="xs:decimal">
                <xs:minInclusive value="0"/>
            </xs:restriction>
        </xs:simpleType>
    </xs:element>

</xs:schema>